{
  "distributionSources": {
    "cdn": {
      "baseUrl": "https://cdn.jsdelivr.net/gh/mythic3011/rules@main",
      "enabled": true,
      "healthCheck": "https://cdn.jsdelivr.net",
      "immutableRevisionSupport": true,
      "priority": 20,
      "type": "cdn"
    },
    "immutable": {
      "baseUrl": "https://cdn.jsdelivr.net/gh/mythic3011/rules@main",
      "enabled": true,
      "healthCheck": "https://cdn.jsdelivr.net",
      "immutableRevisionSupport": true,
      "priority": 40,
      "type": "cdn"
    },
    "raw": {
      "baseUrl": "https://raw.githubusercontent.com/mythic3011/rules/refs/heads/main",
      "enabled": true,
      "healthCheck": "https://raw.githubusercontent.com",
      "immutableRevisionSupport": true,
      "priority": 30,
      "type": "github-raw"
    },
    "rolling": {
      "baseUrl": "https://testingcf.jsdelivr.net/gh/mythic3011/rules@main",
      "enabled": true,
      "healthCheck": "https://testingcf.jsdelivr.net",
      "immutableRevisionSupport": false,
      "priority": 10,
      "type": "cdn"
    }
  },
  "gaming": {
    "destinationCidrs": [],
    "protectedUdpPorts": [
      443
    ],
    "tcpPorts": [],
    "udpDestinationPorts": [
      26500,
      26501,
      26502,
      26503,
      26504,
      26505,
      26506,
      26507,
      26508,
      26509,
      26510,
      26511,
      26512,
      26513,
      26514,
      26515,
      26516,
      26517,
      26518,
      26519,
      26520,
      26521,
      26522,
      26523,
      26524,
      26525,
      26526,
      26527,
      26528,
      26529,
      26530,
      26531,
      26532,
      26533,
      26534,
      26535,
      26536,
      26537,
      26538,
      26539,
      26540,
      26541,
      26542,
      26543,
      26544,
      26545,
      26546,
      26547,
      26548,
      26549,
      26550,
      26551,
      26552,
      26553,
      26554,
      26555,
      26556,
      26557,
      26558,
      26559,
      26560,
      26561,
      26562,
      26563,
      26564,
      26565,
      26566,
      26567,
      26568,
      26569,
      26570,
      26571,
      26572,
      26573,
      26574,
      26575,
      26576,
      26577,
      26578,
      26579,
      26580,
      26581,
      26582,
      26583,
      26584,
      26585,
      26586,
      26587,
      26588,
      26589,
      26590,
      26591,
      26592,
      26593,
      26594,
      26595,
      26596,
      26597,
      26598,
      26599,
      26600,
      27000,
      27001,
      27002,
      27003,
      27004,
      27005,
      27006,
      27007,
      27008,
      27009,
      27010,
      27011,
      27012,
      27013,
      27014,
      27015,
      27016,
      27017,
      27018,
      27019,
      27020,
      27021,
      27022,
      27023,
      27024,
      27025,
      27026,
      27027,
      27028,
      27029,
      27030,
      27031,
      27032,
      27033,
      27034,
      27035,
      27036,
      27037,
      27038,
      27039,
      27040,
      27041,
      27042,
      27043,
      27044,
      27045,
      27046,
      27047,
      27048,
      27049,
      27050,
      27051,
      27052,
      27053,
      27054,
      27055,
      27056,
      27057,
      27058,
      27059,
      27060,
      27061,
      27062,
      27063,
      27064,
      27065,
      27066,
      27067,
      27068,
      27069,
      27070,
      27071,
      27072,
      27073,
      27074,
      27075,
      27076,
      27077,
      27078,
      27079,
      27080,
      27081,
      27082,
      27083,
      27084,
      27085,
      27086,
      27087,
      27088,
      27089,
      27090,
      27091,
      27092,
      27093,
      27094,
      27095,
      27096,
      27097,
      27098,
      27099,
      27100,
      27101,
      27102,
      27103,
      27104,
      27105,
      27106,
      27107,
      27108,
      27109,
      27110,
      27111,
      27112,
      27113,
      27114,
      27115,
      27116,
      27117,
      27118,
      27119,
      27120,
      27121,
      27122,
      27123,
      27124,
      27125,
      27126,
      27127,
      27128,
      27129,
      27130,
      27131,
      27132,
      27133,
      27134,
      27135,
      27136,
      27137,
      27138,
      27139,
      27140,
      27141,
      27142,
      27143,
      27144,
      27145,
      27146,
      27147,
      27148,
      27149,
      27150,
      27151,
      27152,
      27153,
      27154,
      27155,
      27156,
      27157,
      27158,
      27159,
      27160,
      27161,
      27162,
      27163,
      27164,
      27165,
      27166,
      27167,
      27168,
      27169,
      27170,
      27171,
      27172,
      27173,
      27174,
      27175,
      27176,
      27177,
      27178,
      27179,
      27180,
      27181,
      27182,
      27183,
      27184,
      27185,
      27186,
      27187,
      27188,
      27189,
      27190,
      27191,
      27192,
      27193,
      27194,
      27195,
      27196,
      27197,
      27198,
      27199,
      27200,
      27201,
      27202,
      27203,
      27204,
      27205,
      27206,
      27207,
      27208,
      27209,
      27210,
      27211,
      27212,
      27213,
      27214,
      27215,
      27216,
      27217,
      27218,
      27219,
      27220,
      27221,
      27222,
      27223,
      27224,
      27225,
      27226,
      27227,
      27228,
      27229,
      27230,
      27231,
      27232,
      27233,
      27234,
      27235,
      27236,
      27237,
      27238,
      27239,
      27240,
      27241,
      27242,
      27243,
      27244,
      27245,
      27246,
      27247,
      27248,
      27249,
      27250,
      29523
    ],
    "udpPorts": [
      26500,
      26501,
      26502,
      26503,
      26504,
      26505,
      26506,
      26507,
      26508,
      26509,
      26510,
      26511,
      26512,
      26513,
      26514,
      26515,
      26516,
      26517,
      26518,
      26519,
      26520,
      26521,
      26522,
      26523,
      26524,
      26525,
      26526,
      26527,
      26528,
      26529,
      26530,
      26531,
      26532,
      26533,
      26534,
      26535,
      26536,
      26537,
      26538,
      26539,
      26540,
      26541,
      26542,
      26543,
      26544,
      26545,
      26546,
      26547,
      26548,
      26549,
      26550,
      26551,
      26552,
      26553,
      26554,
      26555,
      26556,
      26557,
      26558,
      26559,
      26560,
      26561,
      26562,
      26563,
      26564,
      26565,
      26566,
      26567,
      26568,
      26569,
      26570,
      26571,
      26572,
      26573,
      26574,
      26575,
      26576,
      26577,
      26578,
      26579,
      26580,
      26581,
      26582,
      26583,
      26584,
      26585,
      26586,
      26587,
      26588,
      26589,
      26590,
      26591,
      26592,
      26593,
      26594,
      26595,
      26596,
      26597,
      26598,
      26599,
      26600,
      27000,
      27001,
      27002,
      27003,
      27004,
      27005,
      27006,
      27007,
      27008,
      27009,
      27010,
      27011,
      27012,
      27013,
      27014,
      27015,
      27016,
      27017,
      27018,
      27019,
      27020,
      27021,
      27022,
      27023,
      27024,
      27025,
      27026,
      27027,
      27028,
      27029,
      27030,
      27031,
      27032,
      27033,
      27034,
      27035,
      27036,
      27037,
      27038,
      27039,
      27040,
      27041,
      27042,
      27043,
      27044,
      27045,
      27046,
      27047,
      27048,
      27049,
      27050,
      27051,
      27052,
      27053,
      27054,
      27055,
      27056,
      27057,
      27058,
      27059,
      27060,
      27061,
      27062,
      27063,
      27064,
      27065,
      27066,
      27067,
      27068,
      27069,
      27070,
      27071,
      27072,
      27073,
      27074,
      27075,
      27076,
      27077,
      27078,
      27079,
      27080,
      27081,
      27082,
      27083,
      27084,
      27085,
      27086,
      27087,
      27088,
      27089,
      27090,
      27091,
      27092,
      27093,
      27094,
      27095,
      27096,
      27097,
      27098,
      27099,
      27100,
      27101,
      27102,
      27103,
      27104,
      27105,
      27106,
      27107,
      27108,
      27109,
      27110,
      27111,
      27112,
      27113,
      27114,
      27115,
      27116,
      27117,
      27118,
      27119,
      27120,
      27121,
      27122,
      27123,
      27124,
      27125,
      27126,
      27127,
      27128,
      27129,
      27130,
      27131,
      27132,
      27133,
      27134,
      27135,
      27136,
      27137,
      27138,
      27139,
      27140,
      27141,
      27142,
      27143,
      27144,
      27145,
      27146,
      27147,
      27148,
      27149,
      27150,
      27151,
      27152,
      27153,
      27154,
      27155,
      27156,
      27157,
      27158,
      27159,
      27160,
      27161,
      27162,
      27163,
      27164,
      27165,
      27166,
      27167,
      27168,
      27169,
      27170,
      27171,
      27172,
      27173,
      27174,
      27175,
      27176,
      27177,
      27178,
      27179,
      27180,
      27181,
      27182,
      27183,
      27184,
      27185,
      27186,
      27187,
      27188,
      27189,
      27190,
      27191,
      27192,
      27193,
      27194,
      27195,
      27196,
      27197,
      27198,
      27199,
      27200,
      27201,
      27202,
      27203,
      27204,
      27205,
      27206,
      27207,
      27208,
      27209,
      27210,
      27211,
      27212,
      27213,
      27214,
      27215,
      27216,
      27217,
      27218,
      27219,
      27220,